{
  "delta_id": "delta-pcram-bulletin-snapshot-pcram-bulletin-2026-05-13t120000z-to-snapshot-pcram-bulletin-2026-05-20t120000z-content-changed",
  "source_id": "pcram-bulletin",
  "previous_snapshot_id": "snapshot-pcram-bulletin-2026-05-13t120000z",
  "current_snapshot_id": "snapshot-pcram-bulletin-2026-05-20t120000z",
  "change_type": "modified",
  "affected_codes": [
    "0101.29.00"
  ],
  "summary": "Normalized payload changed between snapshots.",
  "operational_impact": "Possible regulatory interpretation impact; human review required before any action.",
  "risk_level": "medium",
  "requires_human_review": true,
  "evidence_paths": [
    "snapshots/pcram/example-source-snapshot-previous.json",
    "snapshots/pcram/example-source-snapshot-current.json"
  ]
}
